{
   "OrderId":1234,
   "CustomerId":"0123456789",
   "ServicesBoundleStatus":[
      {
         "ServiceId":"5",
         "Description":"Service Description",
         "Status":"Success"
      },
      {
         "ServiceId":"3",
         "Description":"Service Description",
         "Status":"Success"
      }
   ],
   "Description":"Service Description",
   "Status":"Completed",
   "links":[
      {
         "rel":"/linkrels/serviceOrder/info",
         "uri":"/service/order/1234",
         "method":"GET"
      },
      {
         "rel":"/linkrels/serviceOrder/updateInfo",
         "uri":"/service/order/1234",
         "method":"PUT"
      },
      {
         "rel":"/linkrels/serviceOrder/delete",
         "uri":"/service/order/1234",
         "method":"DELETE"
      }
   ]
}